{"$id":"urn:dander:control:contracts:v1:deployment-preview","$schema":"https://json-schema.org/draft/2020-12/schema","additionalProperties":false,"properties":{"affected_jobs":{"items":{"type":"string"},"title":"Affected Jobs","type":"array"},"candidate_image":{"title":"Candidate Image","type":"string"},"plan_sha256":{"pattern":"^[0-9a-f]{64}$","title":"Plan Sha256","type":"string"},"plan_summary":{"title":"Plan Summary","type":"string"},"plan_text":{"title":"Plan Text","type":"string"},"revision":{"title":"Revision","type":"string"}},"required":["revision","candidate_image","plan_sha256","plan_summary","plan_text"],"title":"DeploymentPreviewResponse","type":"object"}
